[
  {
    "id": "hero_05",
    "name": "Dorath Pedra-Cinza",
    "class_id": "pos_dps",
    "position": "DPS",
    "position_id": "pos_dps",
    "specialization": "Assassino",
    "specialization_id": "spec_rogue_assassin",
    "specialization_name": "Assassino",
    "role_title": "DPS - Assassino",
    "class_name": "DPS - Assassino",
    "age": 31,
    "level": 3,
    "xp": 0,
    "current_power": 48,
    "status": "Apto",
    "fatigue": 15,
    "salary": 50,
    "injured": false,
    "injury_weeks_left": 0,
    "contract_seasons_left": 2,
    "season_appearances": 0,
    "happiness": 85,
    "hidden_attributes": {
      "str": 47,
      "agi": 52,
      "vit": 39,
      "int": 40,
      "wis": 40,
      "lck": 48
    },
    "potential": {
      "star_potential": 4,
      "is_potential_revealed": true
    }
  },
  {
    "id": "hero_01",
    "name": "Valdris, o Escudeiro Sênior",
    "class_id": "pos_vanguarda",
    "position": "Vanguarda",
    "position_id": "pos_vanguarda",
    "specialization": "Guardião",
    "specialization_id": "spec_warrior_swordsman",
    "specialization_name": "Guardião",
    "role_title": "Vanguarda - Guardião",
    "class_name": "Vanguarda - Guardião",
    "age": 33,
    "level": 3,
    "xp": 0,
    "current_power": 46,
    "status": "Apto",
    "fatigue": 20,
    "salary": 45,
    "injured": false,
    "injury_weeks_left": 0,
    "contract_seasons_left": 2,
    "season_appearances": 0,
    "happiness": 85,
    "hidden_attributes": {
      "str": 44,
      "agi": 54,
      "vit": 48,
      "int": 40,
      "wis": 32,
      "lck": 34
    },
    "potential": {
      "star_potential": 4,
      "is_potential_revealed": true
    }
  },
  {
    "id": "hero_03",
    "name": "Magister Vorn",
    "class_id": "pos_dps",
    "position": "DPS",
    "position_id": "pos_dps",
    "specialization": "Piromante",
    "specialization_id": "spec_mage_pyromancer",
    "specialization_name": "Piromante",
    "role_title": "DPS - Piromante",
    "class_name": "DPS - Piromante",
    "age": 29,
    "level": 2,
    "xp": 0,
    "current_power": 44,
    "status": "Apto",
    "fatigue": 0,
    "salary": 45,
    "injured": false,
    "injury_weeks_left": 0,
    "contract_seasons_left": 2,
    "season_appearances": 0,
    "happiness": 85,
    "hidden_attributes": {
      "str": 39,
      "agi": 39,
      "vit": 38,
      "int": 49,
      "wis": 44,
      "lck": 31
    },
    "potential": {
      "star_potential": 5,
      "is_potential_revealed": true
    }
  },
  {
    "id": "hero_06",
    "name": "Brakka Fúria-de-Aço",
    "class_id": "pos_vanguarda",
    "position": "Vanguarda",
    "position_id": "pos_vanguarda",
    "specialization": "Berserk",
    "specialization_id": "spec_warrior_berserker",
    "specialization_name": "Berserk",
    "role_title": "Vanguarda - Berserk",
    "class_name": "Vanguarda - Berserk",
    "age": 26,
    "level": 2,
    "xp": 0,
    "current_power": 42,
    "status": "Apto",
    "fatigue": 10,
    "salary": 40,
    "injured": false,
    "injury_weeks_left": 0,
    "contract_seasons_left": 2,
    "season_appearances": 0,
    "happiness": 85,
    "hidden_attributes": {
      "str": 48,
      "agi": 39,
      "vit": 43,
      "int": 33,
      "wis": 28,
      "lck": 29
    },
    "potential": {
      "star_potential": 3,
      "is_potential_revealed": true
    }
  },
  {
    "id": "hero_07",
    "name": "Irmão Cedric da Alvorada",
    "class_id": "pos_suporte",
    "position": "Suporte",
    "position_id": "pos_suporte",
    "specialization": "Clérigo de Apoio",
    "specialization_id": "spec_cleric_support",
    "specialization_name": "Clérigo de Apoio",
    "role_title": "Suporte - Clérigo de Apoio",
    "class_name": "Suporte - Clérigo de Apoio",
    "age": 27,
    "level": 2,
    "xp": 0,
    "current_power": 40,
    "status": "Apto",
    "fatigue": 5,
    "salary": 38,
    "injured": false,
    "injury_weeks_left": 0,
    "contract_seasons_left": 3,
    "season_appearances": 0,
    "happiness": 85,
    "hidden_attributes": {
      "str": 32,
      "agi": 28,
      "vit": 43,
      "int": 41,
      "wis": 44,
      "lck": 33
    },
    "potential": {
      "star_potential": 4,
      "is_potential_revealed": true
    }
  },
  {
    "id": "hero_08",
    "name": "Lyra Flecha-Silenciosa",
    "class_id": "pos_suporte_logistico",
    "position": "Suporte Logístico",
    "position_id": "pos_suporte_logistico",
    "specialization": "Arqueiro",
    "specialization_id": "spec_rogue_archer",
    "specialization_name": "Arqueiro",
    "role_title": "Suporte Logístico - Arqueiro",
    "class_name": "Suporte Logístico - Arqueiro",
    "age": 22,
    "level": 2,
    "xp": 0,
    "current_power": 38,
    "status": "Apto",
    "fatigue": 10,
    "salary": 35,
    "injured": false,
    "injury_weeks_left": 0,
    "contract_seasons_left": 3,
    "season_appearances": 0,
    "happiness": 85,
    "hidden_attributes": {
      "str": 27,
      "agi": 44,
      "vit": 29,
      "int": 31,
      "wis": 30,
      "lck": 39
    },
    "potential": {
      "star_potential": 4,
      "is_potential_revealed": false
    }
  },
  {
    "id": "hero_02",
    "name": "Seren Ironthorn, a Intendente",
    "class_id": "pos_suporte_logistico",
    "position": "Suporte Logístico",
    "position_id": "pos_suporte_logistico",
    "specialization": "Intendente",
    "specialization_id": "spec_logistics_quartermaster",
    "specialization_name": "Intendente",
    "role_title": "Suporte Logístico - Intendente",
    "class_name": "Suporte Logístico - Intendente",
    "age": 24,
    "level": 1,
    "xp": 0,
    "current_power": 35,
    "status": "Fatigado",
    "fatigue": 65,
    "salary": 30,
    "injured": false,
    "injury_weeks_left": 0,
    "contract_seasons_left": 2,
    "season_appearances": 0,
    "happiness": 85,
    "hidden_attributes": {
      "str": 30,
      "agi": 35,
      "vit": 38,
      "int": 35,
      "wis": 37,
      "lck": 26
    },
    "potential": {
      "star_potential": 3,
      "is_potential_revealed": true
    }
  },
  {
    "id": "hero_04",
    "name": "Reva, a Taumaturga",
    "class_id": "pos_suporte",
    "position": "Suporte",
    "position_id": "pos_suporte",
    "specialization": "Taumaturgo",
    "specialization_id": "spec_cleric_thaumaturge",
    "specialization_name": "Taumaturgo",
    "role_title": "Suporte - Taumaturgo",
    "class_name": "Suporte - Taumaturgo",
    "age": 20,
    "level": 1,
    "xp": 0,
    "current_power": 30,
    "status": "Afastado",
    "fatigue": 0,
    "salary": 25,
    "injured": true,
    "injury_weeks_left": 1,
    "contract_seasons_left": 3,
    "season_appearances": 0,
    "happiness": 85,
    "hidden_attributes": {
      "str": 15,
      "agi": 29,
      "vit": 27,
      "int": 37,
      "wis": 30,
      "lck": 16
    },
    "potential": {
      "star_potential": 4,
      "is_potential_revealed": true
    }
  }
]